{
  "manifest_version": "1.0.0",
  "lattice_source": "gcslc_deep_join.fetch_lga_catalog_raw — hard-wired to 774 national cardinality",
  "north_state_count": 19,
  "north_lga_row_count": 413,
  "schema_notes": {
    "apex_traditional": "Sovereign narrative row — does not replace statutory government.",
    "lga_domains": "Every name matches catalogue exactly; spine weld uses ADM2_EN alignment + pcode from HDX/geoBoundaries.",
    "friction": "Emirate splits / five-seat Kano overlays live in parallel JSON (northern_tier_research_audit), never in LGA renames.",
    "forensic_injunction_overlay": "KT/KN only — chancellery-first traditional chains; Kano 8 + rotational council metadata; no proximity geometry for emirate assignment."
  },
  "states": [
    {
      "state_code": "SO",
      "state_en": "Sokoto",
      "apex_traditional": {
        "title": "Sultan of Sokoto",
        "traditional_order": "Sokoto Caliphate seat",
        "notes": "Spiritual & historical primacy — LGA domains are statutory 774, not caliphal boundary."
      },
      "lga_domains": [
        {
          "lga_lattice_name": "Binji",
          "lga_id_note": "Resolved at runtime via ADM2 + 774 fused row key = (state_code, name)"
        },
        {
          "lga_lattice_name": "Bodinga",
          "lga_id_note": "Resolved at runtime via ADM2 + 774 fused row key = (state_code, name)"
        },
        {
          "lga_lattice_name": "Dange Shuni",
          "lga_id_note": "Resolved at runtime via ADM2 + 774 fused row key = (state_code, name)"
        },
        {
          "lga_lattice_name": "Gada",
          "lga_id_note": "Resolved at runtime via ADM2 + 774 fused row key = (state_code, name)"
        },
        {
          "lga_lattice_name": "Goronyo",
          "lga_id_note": "Resolved at runtime via ADM2 + 774 fused row key = (state_code, name)"
        },
        {
          "lga_lattice_name": "Gudu",
          "lga_id_note": "Resolved at runtime via ADM2 + 774 fused row key = (state_code, name)"
        },
        {
          "lga_lattice_name": "Gwadabawa",
          "lga_id_note": "Resolved at runtime via ADM2 + 774 fused row key = (state_code, name)"
        },
        {
          "lga_lattice_name": "Illela",
          "lga_id_note": "Resolved at runtime via ADM2 + 774 fused row key = (state_code, name)"
        },
        {
          "lga_lattice_name": "Isa",
          "lga_id_note": "Resolved at runtime via ADM2 + 774 fused row key = (state_code, name)"
        },
        {
          "lga_lattice_name": "Kebbe",
          "lga_id_note": "Resolved at runtime via ADM2 + 774 fused row key = (state_code, name)"
        },
        {
          "lga_lattice_name": "Kware",
          "lga_id_note": "Resolved at runtime via ADM2 + 774 fused row key = (state_code, name)"
        },
        {
          "lga_lattice_name": "Rabah",
          "lga_id_note": "Resolved at runtime via ADM2 + 774 fused row key = (state_code, name)"
        },
        {
          "lga_lattice_name": "Sabon Birni",
          "lga_id_note": "Resolved at runtime via ADM2 + 774 fused row key = (state_code, name)"
        },
        {
          "lga_lattice_name": "Shagari",
          "lga_id_note": "Resolved at runtime via ADM2 + 774 fused row key = (state_code, name)"
        },
        {
          "lga_lattice_name": "Silame",
          "lga_id_note": "Resolved at runtime via ADM2 + 774 fused row key = (state_code, name)"
        },
        {
          "lga_lattice_name": "Sokoto North",
          "lga_id_note": "Resolved at runtime via ADM2 + 774 fused row key = (state_code, name)"
        },
        {
          "lga_lattice_name": "Sokoto South",
          "lga_id_note": "Resolved at runtime via ADM2 + 774 fused row key = (state_code, name)"
        },
        {
          "lga_lattice_name": "Tambuwal",
          "lga_id_note": "Resolved at runtime via ADM2 + 774 fused row key = (state_code, name)"
        },
        {
          "lga_lattice_name": "Tangaza",
          "lga_id_note": "Resolved at runtime via ADM2 + 774 fused row key = (state_code, name)"
        },
        {
          "lga_lattice_name": "Tureta",
          "lga_id_note": "Resolved at runtime via ADM2 + 774 fused row key = (state_code, name)"
        },
        {
          "lga_lattice_name": "Wamako",
          "lga_id_note": "Resolved at runtime via ADM2 + 774 fused row key = (state_code, name)"
        },
        {
          "lga_lattice_name": "Wurno",
          "lga_id_note": "Resolved at runtime via ADM2 + 774 fused row key = (state_code, name)"
        },
        {
          "lga_lattice_name": "Yabo",
          "lga_id_note": "Resolved at runtime via ADM2 + 774 fused row key = (state_code, name)"
        }
      ],
      "lga_count": 23
    },
    {
      "state_code": "KE",
      "state_en": "Kebbi",
      "apex_traditional": {
        "title": "Emir of Argungu",
        "traditional_order": "Kebbi traditional constellation",
        "notes": "Multiple emirate seats in-state; apex row is schema primary — sub-emirates via future child rows."
      },
      "lga_domains": [
        {
          "lga_lattice_name": "Aleiro",
          "lga_id_note": "Resolved at runtime via ADM2 + 774 fused row key = (state_code, name)"
        },
        {
          "lga_lattice_name": "Arewa Dandi",
          "lga_id_note": "Resolved at runtime via ADM2 + 774 fused row key = (state_code, name)"
        },
        {
          "lga_lattice_name": "Argungu",
          "lga_id_note": "Resolved at runtime via ADM2 + 774 fused row key = (state_code, name)"
        },
        {
          "lga_lattice_name": "Augie",
          "lga_id_note": "Resolved at runtime via ADM2 + 774 fused row key = (state_code, name)"
        },
        {
          "lga_lattice_name": "Bagudo",
          "lga_id_note": "Resolved at runtime via ADM2 + 774 fused row key = (state_code, name)"
        },
        {
          "lga_lattice_name": "Birnin Kebbi",
          "lga_id_note": "Resolved at runtime via ADM2 + 774 fused row key = (state_code, name)"
        },
        {
          "lga_lattice_name": "Bunza",
          "lga_id_note": "Resolved at runtime via ADM2 + 774 fused row key = (state_code, name)"
        },
        {
          "lga_lattice_name": "Dandi",
          "lga_id_note": "Resolved at runtime via ADM2 + 774 fused row key = (state_code, name)"
        },
        {
          "lga_lattice_name": "Fakai",
          "lga_id_note": "Resolved at runtime via ADM2 + 774 fused row key = (state_code, name)"
        },
        {
          "lga_lattice_name": "Gwandu",
          "lga_id_note": "Resolved at runtime via ADM2 + 774 fused row key = (state_code, name)"
        },
        {
          "lga_lattice_name": "Jega",
          "lga_id_note": "Resolved at runtime via ADM2 + 774 fused row key = (state_code, name)"
        },
        {
          "lga_lattice_name": "Kalgo",
          "lga_id_note": "Resolved at runtime via ADM2 + 774 fused row key = (state_code, name)"
        },
        {
          "lga_lattice_name": "Koko/Besse",
          "lga_id_note": "Resolved at runtime via ADM2 + 774 fused row key = (state_code, name)"
        },
        {
          "lga_lattice_name": "Maiyama",
          "lga_id_note": "Resolved at runtime via ADM2 + 774 fused row key = (state_code, name)"
        },
        {
          "lga_lattice_name": "Ngaski",
          "lga_id_note": "Resolved at runtime via ADM2 + 774 fused row key = (state_code, name)"
        },
        {
          "lga_lattice_name": "Sakaba",
          "lga_id_note": "Resolved at runtime via ADM2 + 774 fused row key = (state_code, name)"
        },
        {
          "lga_lattice_name": "Shanga",
          "lga_id_note": "Resolved at runtime via ADM2 + 774 fused row key = (state_code, name)"
        },
        {
          "lga_lattice_name": "Suru",
          "lga_id_note": "Resolved at runtime via ADM2 + 774 fused row key = (state_code, name)"
        },
        {
          "lga_lattice_name": "Wasagu/Danko",
          "lga_id_note": "Resolved at runtime via ADM2 + 774 fused row key = (state_code, name)"
        },
        {
          "lga_lattice_name": "Yauri",
          "lga_id_note": "Resolved at runtime via ADM2 + 774 fused row key = (state_code, name)"
        },
        {
          "lga_lattice_name": "Zuru",
          "lga_id_note": "Resolved at runtime via ADM2 + 774 fused row key = (state_code, name)"
        }
      ],
      "lga_count": 21
    },
    {
      "state_code": "ZA",
      "state_en": "Zamfara",
      "apex_traditional": {
        "title": "Emir of Anka",
        "traditional_order": "Zamfara emirate council",
        "notes": "Verify palace roster against statute — LGA list remains 774."
      },
      "lga_domains": [
        {
          "lga_lattice_name": "Anka",
          "lga_id_note": "Resolved at runtime via ADM2 + 774 fused row key = (state_code, name)"
        },
        {
          "lga_lattice_name": "Bakura",
          "lga_id_note": "Resolved at runtime via ADM2 + 774 fused row key = (state_code, name)"
        },
        {
          "lga_lattice_name": "Birnin Magaji/Kiyaw",
          "lga_id_note": "Resolved at runtime via ADM2 + 774 fused row key = (state_code, name)"
        },
        {
          "lga_lattice_name": "Bukkuyum",
          "lga_id_note": "Resolved at runtime via ADM2 + 774 fused row key = (state_code, name)"
        },
        {
          "lga_lattice_name": "Bungudu",
          "lga_id_note": "Resolved at runtime via ADM2 + 774 fused row key = (state_code, name)"
        },
        {
          "lga_lattice_name": "Chafe",
          "lga_id_note": "Resolved at runtime via ADM2 + 774 fused row key = (state_code, name)"
        },
        {
          "lga_lattice_name": "Gummi",
          "lga_id_note": "Resolved at runtime via ADM2 + 774 fused row key = (state_code, name)"
        },
        {
          "lga_lattice_name": "Gusau",